{
  "$schema": "https://elabora.studio/schemas/0.1.9/component.schema.json",
  "id": "maneuver-quiz",
  "title": "Manoeuvre question",
  "description": "A choice question whose options are burns, shown as cards with a diagram of the thrust direction. A fork of the quiz block: same scoring, feedback, saved state and SCORM records.",
  "instructions": "Use for questions whose options are manoeuvres. Give each option a diagram (images/burn-<direction>.svg, generated by generators/figures.mjs). The diagram shows what the option says (the thrust direction), never the outcome. Two to four options.",
  "category": "assessment",
  "version": "1.0.0",
  "extends": { "component": "quiz", "version": "0.1.0" },
  "propsExtend": {
    "properties": {
      "options": {
        "items": {
          "properties": {
            "figure": { "type": "string", "x-kind": "asset", "description": "Diagram of the burn (decorative: the option text says it)." }
          }
        }
      }
    }
  },
  "examples": [
    {
      "title": "Inline practice question",
      "props": {
        "stem": "You fly **50 km behind** the client satellite. Which first burn closes the gap?",
        "mode": "single",
        "scored": false,
        "options": [
          { "id": "a", "text": "Prograde, towards the client", "correct": false, "feedback": "You climb and slow down.", "figure": "images/burn-prograde.svg" },
          { "id": "b", "text": "Retrograde, away from the client", "correct": true, "feedback": "You drop and speed up.", "figure": "images/burn-retrograde.svg" },
          { "id": "c", "text": "Radial, towards the Earth", "correct": false, "feedback": "Same period: no drift.", "figure": "images/burn-radial.svg" }
        ]
      }
    }
  ]
}
