{
  "$schema": "https://elabora.studio/schemas/0.1.7/component.schema.json",
  "id": "layered-figure",
  "title": "Figure in layers",
  "description": "« Étapes » drawn as one figure that assembles itself as it scrolls into view: figureImage first, then each step's image, a layer drawn over it one after the other (fading, sweeping round, dropping in, wiped from the top), and labels set over the figure at given positions (words, or harbour names written from a point at any angle, as on a chart, or someone's words in a bubble). Square or wide, full size or compact beside the reading column. The steps' titles and texts name the layers for text views and exports; the figure's alt describes it whole. Without scroll-driven animations, with reduced motion, or set to show at once (still), it shows complete.",
  "instructions": "Draw every layer in the same frame as figureImage (generators); mark the layers decorative and describe the whole figure in figureAlt (or, without figureImage, give the one layer its alt). Each step's title names what its layer adds in a few words, its text says it in one sentence. Labels are words: keep them short, and place them in % of the figure (x from the left, y from the top).",
  "version": "2.0.0",
  "extends": {
    "component": "steps",
    "version": "0.1.0"
  },
  "propsExtend": {
    "properties": {
      "presentation": {
        "enum": [
          "scroll"
        ],
        "default": "scroll",
        "description": "scroll: the figure assembles as the page scrolls it into view (the only presentation of this style)."
      },
      "figure": {
        "enum": [
          "build"
        ],
        "default": "build",
        "description": "build: each step's image is a layer drawn over figureImage."
      },
      "items": {
        "items": {
          "properties": {
            "reveal": {
              "enum": [
                "fade",
                "sweep",
                "drop",
                "wipe"
              ],
              "default": "fade",
              "x-group": "design",
              "description": "fade: appears; sweep: drawn round like a compass; drop: falls into place; wipe: drawn from top to bottom.",
              "x-enum-labels": {
                "fade": "Fade",
                "sweep": "Compass sweep",
                "drop": "Drop",
                "wipe": "Wipe down"
              }
            }
          }
        }
      },
      "baseReveal": {
        "enum": [
          "fade",
          "sweep",
          "drop",
          "wipe"
        ],
        "default": "fade",
        "x-group": "design",
        "description": "How figureImage appears (see the steps' reveal).",
        "x-enum-labels": {
          "fade": "Fade",
          "sweep": "Compass sweep",
          "drop": "Drop",
          "wipe": "Wipe down"
        }
      },
      "still": {
        "type": "boolean",
        "default": false,
        "x-group": "design",
        "description": "true: shown complete at once (a figure at the top of a page), without assembling as it scrolls."
      },
      "ratio": {
        "type": "number",
        "minimum": 0.5,
        "maximum": 3,
        "default": 1,
        "x-group": "design",
        "description": "Width ÷ height of the figure and of every layer (1: square; 1.96 for the chart on its skin)."
      },
      "size": {
        "enum": [
          "full",
          "compact"
        ],
        "default": "full",
        "x-group": "design",
        "description": "full: as large as the block allows; compact: small enough to see whole with the text around it.",
        "x-enum-labels": {
          "full": "Full",
          "compact": "Compact"
        }
      },
      "labels": {
        "type": "array",
        "maxItems": 24,
        "default": [],
        "items": {
          "type": "object",
          "additionalProperties": false,
          "required": [
            "text",
            "x",
            "y"
          ],
          "properties": {
            "text": {
              "type": "string",
              "maxLength": 40,
              "x-translatable": true
            },
            "x": {
              "type": "number",
              "minimum": 0,
              "maximum": 100,
              "description": "Horizontal position, in % of the figure."
            },
            "y": {
              "type": "number",
              "minimum": 0,
              "maximum": 100,
              "description": "Vertical position, in % of the figure."
            },
            "tone": {
              "enum": [
                "ink",
                "rubric",
                "italic",
                "name",
                "name-rubric",
                "bubble",
                "bubble-below"
              ],
              "default": "ink",
              "x-group": "design",
              "description": "ink: small capitals; rubric: small capitals in red; italic: an aside; name and name-rubric: a harbour name as written on a chart, in black or red, starting at its point (x, y) and running at its angle; bubble and bubble-below: someone's words in a speech bubble above or below its point, the tail pointing at it (angle ignored).",
              "x-enum-labels": {
                "ink": "Ink capitals",
                "rubric": "Red capitals",
                "italic": "Italic aside",
                "name": "Place name",
                "name-rubric": "Place name in red",
                "bubble": "Bubble",
                "bubble-below": "Bubble below"
              }
            },
            "angle": {
              "type": "number",
              "minimum": -180,
              "maximum": 180,
              "default": 0,
              "description": "Rotation of the label in degrees, clockwise (90: reads downwards, along a river; beyond ±90 a name reads upside down, as on a chart read from every side)."
            }
          }
        }
      },
      "caption": {
        "type": "string",
        "x-kind": "markdown",
        "maxLength": 300,
        "x-translatable": true
      }
    }
  },
  "fallback": [
    {
      "type": "steps",
      "props": {
        "presentation": "scroll",
        "figure": "build",
        "side": "{{side}}",
        "numbered": "{{numbered}}",
        "intro": "{{intro}}",
        "summary": "{{summary}}",
        "figureImage": "{{figureImage}}",
        "figureAlt": "{{figureAlt}}",
        "items": "{{items}}"
      }
    },
    {
      "$if": "labels",
      "type": "text",
      "props": {
        "markdown": "{{#labels}}- {{text}}\n{{/labels}}"
      }
    },
    {
      "$if": "caption",
      "type": "text",
      "props": {
        "markdown": "{{caption}}"
      }
    }
  ],
  "examples": [
    {
      "title": "T-O map",
      "props": {
        "presentation": "scroll",
        "figure": "build",
        "figureImage": "images/to-ocean.svg",
        "figureAlt": "A T-O map",
        "items": [
          {
            "id": "tee",
            "title": "The T of waters",
            "markdown": "The Mediterranean, the Don and the Nile.",
            "image": "images/to-tee.svg",
            "decorative": true,
            "reveal": "drop"
          }
        ],
        "labels": [
          {
            "text": "Asia",
            "x": 50,
            "y": 28
          }
        ]
      }
    }
  ]
}
